{
  "schema_version": "1.0.0",
  "artifact": "assembly-manifest",
  "run_id": "RUN-20260531-142632",
  "generated_at": "2026-05-31T20:37:38+08:00",
  "producer": {
    "agent": "Word Layout Agent",
    "version": "1.0.0"
  },
  "inputs": [
    {
      "artifact": "template",
      "path": "templates/投标方案模板.docx",
      "schema_version": "template-docx"
    },
    {
      "artifact": "content-blocks",
      "path": "output/records/content-blocks.json",
      "schema_version": "1.0.0"
    },
    {
      "artifact": "diagram-manifest",
      "path": "output/records/diagram-manifest.json",
      "schema_version": "1.0.0"
    },
    {
      "artifact": "requirements",
      "path": "output/records/requirements.json",
      "schema_version": "1.0.0"
    },
    {
      "artifact": "release-decision",
      "path": "output/records/release-decision.json",
      "schema_version": "1.0.0"
    }
  ],
  "template_path": "templates/投标方案模板.docx",
  "output_docx": "output/validation11/电子海图显示与信息系统设计方案_V1.00_20260531.docx",
  "review_decision": "approved",
  "placeholders": [
    {
      "placeholder": "【COPY:项目名称】",
      "status": "filled",
      "source": "requirements.json",
      "message": "已按需求事实源替换 COPY 占位符。"
    },
    {
      "placeholder": "【COPY:项目名称】",
      "status": "filled",
      "source": "requirements.json",
      "message": "已按需求事实源替换 COPY 占位符。"
    },
    {
      "placeholder": "【GEN:编写目的】",
      "status": "review_inserted",
      "source": "CB001",
      "message": "已插入 paragraphs 内容块。"
    },
    {
      "placeholder": "【GEN:建设内容】",
      "status": "filled",
      "source": "CB023",
      "message": "已插入 paragraphs 内容块。"
    },
    {
      "placeholder": "【COPY:项目名称】",
      "status": "filled",
      "source": "requirements.json",
      "message": "已按需求事实源替换 COPY 占位符。"
    },
    {
      "placeholder": "【COPY:项目名称】",
      "status": "filled",
      "source": "requirements.json",
      "message": "已按需求事实源替换 COPY 占位符。"
    },
    {
      "placeholder": "【COPY:技术要求-功能要求】",
      "status": "filled",
      "source": "requirements.json",
      "message": "已按需求事实源替换 COPY 占位符。"
    },
    {
      "placeholder": "【COPY:技术要求-性能要求】",
      "status": "filled",
      "source": "requirements.json",
      "message": "已按需求事实源替换 COPY 占位符。"
    },
    {
      "placeholder": "【COPY:技术要求-通用质量特性要求】",
      "status": "filled",
      "source": "requirements.json",
      "message": "已按需求事实源替换 COPY 占位符。"
    },
    {
      "placeholder": "【GEN:总体架构设计】",
      "status": "review_inserted",
      "source": "CB002",
      "message": "已插入 paragraphs 内容块。"
    },
    {
      "placeholder": "【GEN:总体架构图】",
      "status": "review_inserted",
      "source": "CB003",
      "message": "已插入 diagram_reference 内容块。"
    },
    {
      "placeholder": "【GEN:架构图说明】",
      "status": "review_inserted",
      "source": "CB004",
      "message": "已插入 paragraphs 内容块。"
    },
    {
      "placeholder": "【GEN:设计原则】",
      "status": "review_inserted",
      "source": "CB005",
      "message": "已插入 paragraphs 内容块。"
    },
    {
      "placeholder": "【GEN:部署架构设计】",
      "status": "filled",
      "source": "CB006",
      "message": "已插入 paragraphs 内容块。"
    },
    {
      "placeholder": "【GEN:功能设计总述】",
      "status": "filled",
      "source": "CB007",
      "message": "已插入 paragraphs 内容块。"
    },
    {
      "placeholder": "【GEN:功能设计章节】",
      "status": "filled",
      "source": "CB008",
      "message": "已插入 rich_content 内容块。"
    },
    {
      "placeholder": "【GEN:性能设计章节】",
      "status": "review_inserted",
      "source": "CB009",
      "message": "已插入 table 内容块。"
    },
    {
      "placeholder": "【GEN:数据库设计总述】",
      "status": "review_inserted",
      "source": "CB024",
      "message": "已插入 paragraphs 内容块。"
    },
    {
      "placeholder": "【GEN:数据库架构设计】",
      "status": "filled",
      "source": "CB010",
      "message": "已插入 paragraphs 内容块。"
    },
    {
      "placeholder": "【GEN:核心业务数据设计】",
      "status": "filled",
      "source": "CB011",
      "message": "已插入 paragraphs 内容块。"
    },
    {
      "placeholder": "【GEN:数据库表设计】",
      "status": "review_inserted",
      "source": "CB025",
      "message": "已插入 paragraphs 内容块。"
    },
    {
      "placeholder": "【GEN:通用质量特性设计总述】",
      "status": "review_inserted",
      "source": "CB012",
      "message": "已插入 paragraphs 内容块。"
    },
    {
      "placeholder": "【GEN:可靠性设计】",
      "status": "review_inserted",
      "source": "CB013",
      "message": "已插入 paragraphs 内容块。"
    },
    {
      "placeholder": "【GEN:维修性设计】",
      "status": "review_inserted",
      "source": "CB014",
      "message": "已插入 paragraphs 内容块。"
    },
    {
      "placeholder": "【GEN:保障性设计】",
      "status": "review_inserted",
      "source": "CB026",
      "message": "已插入 paragraphs 内容块。"
    },
    {
      "placeholder": "【GEN:测试性设计】",
      "status": "review_inserted",
      "source": "CB015",
      "message": "已插入 paragraphs 内容块。"
    },
    {
      "placeholder": "【GEN:安全性设计】",
      "status": "review_inserted",
      "source": "CB016",
      "message": "已插入 paragraphs 内容块。"
    },
    {
      "placeholder": "【GEN:环境适应性设计】",
      "status": "filled",
      "source": "CB017",
      "message": "已插入 paragraphs 内容块。"
    },
    {
      "placeholder": "【GEN:关键技术】",
      "status": "review_inserted",
      "source": "CB018",
      "message": "已插入 paragraphs 内容块。"
    },
    {
      "placeholder": "【GEN:质量控制总述】",
      "status": "review_inserted",
      "source": "CB027",
      "message": "已插入 paragraphs 内容块。"
    },
    {
      "placeholder": "【GEN:风险评估与控制】",
      "status": "review_inserted",
      "source": "CB019",
      "message": "已插入 review_text 内容块。"
    },
    {
      "placeholder": "【GEN:质量保证措施】",
      "status": "review_inserted",
      "source": "CB028",
      "message": "已插入 paragraphs 内容块。"
    },
    {
      "placeholder": "【REVIEW:质量体系与资质响应说明】",
      "status": "review_inserted",
      "source": "CB029",
      "message": "已插入 review_text 内容块。"
    },
    {
      "placeholder": "【REVIEW:服务质量保障措施】",
      "status": "review_inserted",
      "source": "CB030",
      "message": "已插入 review_text 内容块。"
    },
    {
      "placeholder": "【REVIEW:项目进度计划】",
      "status": "review_inserted",
      "source": "CB031",
      "message": "已插入 review_text 内容块。"
    },
    {
      "placeholder": "【CONFIRM:项目团队人员说明】",
      "status": "preserved_confirm",
      "source": "CB021",
      "message": "已按规则保留 CONFIRM 占位符。"
    },
    {
      "placeholder": "【CONFIRM:项目团队-职务分工】",
      "status": "preserved_confirm",
      "source": "confirm_items",
      "message": "已按规则保留 CONFIRM 占位符。"
    },
    {
      "placeholder": "【CONFIRM:项目团队-姓名】",
      "status": "preserved_confirm",
      "source": "confirm_items",
      "message": "已按规则保留 CONFIRM 占位符。"
    },
    {
      "placeholder": "【CONFIRM:项目团队-职称】",
      "status": "preserved_confirm",
      "source": "confirm_items",
      "message": "已按规则保留 CONFIRM 占位符。"
    },
    {
      "placeholder": "【CONFIRM:项目团队-专业】",
      "status": "preserved_confirm",
      "source": "confirm_items",
      "message": "已按规则保留 CONFIRM 占位符。"
    },
    {
      "placeholder": "【CONFIRM:项目团队-从业资格】",
      "status": "preserved_confirm",
      "source": "confirm_items",
      "message": "已按规则保留 CONFIRM 占位符。"
    },
    {
      "placeholder": "【CONFIRM:项目团队-相关工作年限】",
      "status": "preserved_confirm",
      "source": "confirm_items",
      "message": "已按规则保留 CONFIRM 占位符。"
    },
    {
      "placeholder": "【REVIEW:成果交付及验收】",
      "status": "review_inserted",
      "source": "CB020",
      "message": "已插入 review_text 内容块。"
    },
    {
      "placeholder": "【REVIEW:交付物清单】",
      "status": "review_inserted",
      "source": "CB032",
      "message": "已插入 review_text 内容块。"
    },
    {
      "placeholder": "【GEN:培训方案】",
      "status": "review_inserted",
      "source": "CB022",
      "message": "已插入 review_text 内容块。"
    },
    {
      "placeholder": "【CONFIRM:质量保证期承诺】",
      "status": "preserved_confirm",
      "source": "confirm_items",
      "message": "已按规则保留 CONFIRM 占位符。"
    },
    {
      "placeholder": "【CONFIRM:售后服务响应承诺】",
      "status": "preserved_confirm",
      "source": "confirm_items",
      "message": "已按规则保留 CONFIRM 占位符。"
    },
    {
      "placeholder": "【REVIEW:应急支援保障承诺】",
      "status": "review_inserted",
      "source": "CB033",
      "message": "已插入 review_text 内容块。"
    },
    {
      "placeholder": "【REVIEW:定期跟踪服务承诺】",
      "status": "review_inserted",
      "source": "CB034",
      "message": "已插入 review_text 内容块。"
    }
  ],
  "assembly_status": "generated",
  "logs": [
    {
      "kind": "placeholder-fill-log",
      "path": "output/records/placeholder-fill-log.md"
    },
    {
      "kind": "assembly-log",
      "path": "output/records/assembly-log.md"
    },
    {
      "kind": "residual-placeholder-check",
      "path": "output/records/residual-placeholder-check.md"
    }
  ]
}
