{
  "schema_version": "1.0.0",
  "artifact": "assembly-manifest",
  "run_id": "RUN-20260530-210000",
  "generated_at": "2026-05-30T21:00:00+08:00",
  "producer": {
    "agent": "Word Layout Agent",
    "version": "1.0.0"
  },
  "inputs": [
    {
      "artifact": "release-decision",
      "path": "output/records/release-decision.json",
      "schema_version": "1.0.0"
    }
  ],
  "template_path": "templates/投标方案模板.docx",
  "output_docx": "output/电子海图显示与信息系统设计方案_V1.00_20260530.docx",
  "review_decision": "approved",
  "placeholders": [
    {
      "placeholder": "【GEN:功能设计章节】",
      "status": "filled",
      "source": "CB001"
    },
    {
      "placeholder": "【CONFIRM:投标人名称】",
      "status": "preserved_confirm",
      "source": "CF001"
    }
  ],
  "assembly_status": "generated",
  "logs": [
    {
      "kind": "placeholder-fill-log",
      "path": "output/records/placeholder-fill-log.md"
    }
  ]
}
